id,milestone,upstream_source,parity_mode,comparator,command_shape,argv,stdin_path,expected_stdout_path,expected_status,expected_stderr_class,status,statistical_plan,source_license_note
pf3-sweep-analyzer,PF3,src/stim/simulators/error_analyzer.test.cc,structural,structural,manifest-only PF3 sweep analyzer split,manifest-only|pf3-sweep-analyzer,,,0,any,manifest-only,RPF3 locked subcases are sweep-aware analyzer behavior for public analyzer or Rust DEM generation cases and unsupported sweep target-shape rejections,Manifest-only row derived from pinned Stim v1.16.0 C++ tests
pf3-analyze-errors-sweep-core,PF3,src/stim/simulators/error_analyzer.test.cc,structural,structural,cargo test stab-core analyzer sweep controls,cargo-test|-p|stab-core|--test|dem_analyzer_classical|sweep,,,0,any,implemented,Runs the PF3 analyzer sweep-control row proving circuit_to_detector_error_model ignores selected sweep-controlled Clifford gates and CZ sweep-sweep record-sweep sweep-record and record-record classical-only no-op groups while rejecting invalid controlled-Pauli target positions,Ported Rust tests derived from pinned Stim v1.16.0 ErrorAnalyzer ignores_sweep_controls and controlled-Pauli target semantics
pf3-analyze-errors-sweep-cli,PF3,src/stim/cmd/command_analyze_errors.test.cc,structural,structural,cargo test stab-cli analyzer sweep controls,cargo-test|-p|stab-cli|analyze_errors_sweep_controls,,,0,any,implemented,Runs the PF3 public CLI analyzer sweep-control row proving stab analyze_errors emits the selected sweep-control and CZ classical-only no-op matrix DEM including CZ record-record and rejects invalid controlled-Pauli target positions with empty stdout nonzero status and actionable stderr,Public CLI regression derived from PF3 core analyzer sweep-control semantics
pf3-gate-semantic-execution,PF3,src/stim/simulators/frame_simulator.test.cc,structural,structural,manifest-only PF3 gate execution split,manifest-only|pf3-gate-semantic-execution,,,0,any,manifest-only,RPF3 locked subcases are legal-gate execution classification and tests across sampler converter detection and analyzer paths with explicit unsupported-shape errors,Manifest-only row derived from pinned Stim v1.16.0 C++ tests
pf3-gate-semantic-wide-rust,PF3,src/stim/simulators/frame_simulator.test.cc,structural,structural,cargo test stab-core fixed-tableau gate semantic execution,cargo-test|-p|stab-core|--test|gate_semantic_execution,,,0,any,implemented,Runs the PF3 Rust fixed-tableau gate execution contract covering all 46 fixed-tableau gates through inverse-canceling sampler detection-conversion and analyzer circuits plus explicit sampler detection-conversion and detector-frame SPP and SPP_DAG execution,Ported Rust structural tests derived from pinned Stim v1.16.0 frame simulator and error analyzer gate-execution coverage
pf3-gate-spp-analyzer-rust,PF3,src/stim/simulators/error_analyzer.test.cc,structural,structural,cargo test stab-core analyzer SPP execution,cargo-test|-p|stab-core|--test|dem_analyzer_mpp|spp,,,0,any,implemented,Runs the PF3 Rust analyzer SPP subset covering explicit expansion parity deterministic and nondeterministic detector or observable behavior pending-error propagation signed products multi-product reduction and anti-Hermitian rejection,Ported Rust structural tests derived from pinned Stim v1.16.0 ErrorAnalyzer SPP behavior and SPP decomposition semantics
pf3-gate-spp-contract-rust,PF3,src/stim/gates/gates.test.cc,structural,structural,cargo test stab-core SPP execution contract,cargo-test|-p|stab-core|--test|gate_metadata|gate_execution_contract,,,0,any,implemented,Runs the PF3 gate support contract check proving SPP and SPP_DAG sampler detection-conversion and analyzer support columns stay synchronized,Source-owned contract coverage derived from pinned Stim v1.16.0 gate metadata and Stab execution support policy
pf3-analyze-errors-spp-state-propagation-cli,PF3,src/stim/simulators/error_analyzer.test.cc,exact-output,exact-output,stim analyze_errors SPP state propagation,analyze_errors,inputs/analyze_errors_spp_state_propagation.stim,expected/pf3_analyze_errors_spp_state_propagation.stdout,0,empty,implemented,,Expected output recorded from pinned Stim v1.16.0 analyze_errors for supported Hermitian SPP state propagation
pf3-analyze-errors-spp-nondeterministic-cli,PF3,src/stim/simulators/error_analyzer.test.cc,exact-output,exact-output,stim analyze_errors SPP nondeterministic detector,analyze_errors,inputs/analyze_errors_spp_nondeterministic.stim,,1,non-empty,implemented,,Expected rejection class recorded from pinned Stim v1.16.0 analyze_errors for nondeterministic SPP detector behavior
pf4-dem-introspection-transforms,PF4,src/stim/dem/detector_error_model.test.cc,structural,structural,manifest-only PF4 DEM introspection and transform split,manifest-only|pf4-dem-introspection-transforms,,,0,any,manifest-only,RPF4 locked subcases are error counts coordinate maps final shifts flattened rounded without_tags tags separators detector shifts coordinate shifts logical observables and repeat behavior,Manifest-only row derived from pinned Stim v1.16.0 C++ tests
pf4-dem-materialized-transforms-rust,PF4,src/stim/dem/detector_error_model.test.cc,structural,structural,cargo test stab-core DEM materialized transforms,cargo-test|-p|stab-core|--test|dem_api|pf4_dem_materialized_,,,0,any,implemented,Runs the RPF4 Rust DEM transform subset covering DetectorErrorModel::flattened and DetectorErrorModel::rounded for empty models detector shifts coordinate shifts tags separators logical observables repeats zero-probability rounding and excessive materialized repeat rejection,Ported Rust tests derived from pinned Stim v1.16.0 DetectorErrorModel flattened and rounded cases
pf4-dem-introspection-query-rust,PF4,src/stim/dem/detector_error_model.test.cc,structural,structural,cargo test stab-core DEM introspection transform queries,cargo-test|-p|stab-core|--test|dem_api|pf4_dem_introspection_transform_,,,0,any,implemented,Runs the RPF4 Rust DEM introspection and transform-query subset covering recursive without_tags final detector shift final coordinate shift error detector and observable counts and selected coordinates through shifted repeats,Ported Rust tests derived from pinned Stim v1.16.0 DetectorErrorModel introspection and tag-stripping behavior
pf4-dem-validation-negative-rust,PF4,src/stim/dem/detector_error_model.test.cc,structural,structural,cargo test stab-core DEM public validation negatives,cargo-test|-p|stab-core|--test|dem_api|pf4_dem_public_validation_,,,0,any,implemented,Runs the RPF4 Rust DEM public validation subset covering malformed text invalid probabilities invalid separators invalid targets invalid repeat counts invalid tags high detector or observable ids detector-shift overflow programmatic non-finite coordinates and repeat-block instruction-only range rejection,Ported Rust tests derived from pinned Stim v1.16.0 DetectorErrorModel validation behavior with Stab-specific public constructor coverage
pf4-dem-coordinate-resource-rust,PF4,src/stim/dem/detector_error_model.test.cc,structural,structural,cargo test stab-core DEM coordinate resource policy,cargo-test|-p|stab-core|--test|dem_api|pf4_dem_coordinates_,,,0,any,implemented,Runs the RPF4 Rust DEM coordinate resource subset proving pinned Stim trivial selected-coordinate cases all-detector coordinate maps reject huge materialization while selected and single detector coordinate lookups fold through huge non-overlapping repeats match the pinned Stim nested-loop coordinate example preserve first-declaration behavior for bounded overlapping repeats find flat sparse overlapping declarations beyond the previous candidate cap find bounded nested sparse overlapping declarations beyond the previous fallback cap return empty coordinates for valid flat sparse holes and selected large non-flat sparse holes using actual declared-detector bounds cover many-selected flat-overlap scans and avoid overvalidating huge far endpoints outside the selected detector range,Semantic-mining row derived from pinned Stim v1.16.0 DetectorErrorModel coordinate API behavior with Stab-specific resource hardening
pf4-dem-coordinate-api,PF4,src/stim/dem/detector_error_model_pybind_test.py,structural,structural,manifest-only PF4 DEM coordinate API split,manifest-only|pf4-dem-coordinate-api,,,0,any,manifest-only,RPF4 locked subcases are Rust count coordinate final-shift and selected-coordinate queries for large and nested repeats with folded traversal or documented caps while Python bindings remain deferred,Semantic-mining row derived from pinned Stim v1.16.0 Python tests
pf4-dem-folded-traversal,PF4,src/stim/simulators/dem_sampler.test.cc,structural,structural,manifest-only PF4 folded traversal split,manifest-only|pf4-dem-folded-traversal,,,0,any,manifest-only,RPF4 locked subcases are folded or capped traversal for graphlike search hypergraph search SAT or WCNF matcher-adjacent operations analyzer-adjacent operations and shifted or otherwise non-selected repeated stochastic direct DEM sampling beyond the selected sampler folds; sampled-error output and replay keep source-owned flat error-bit caps,Manifest-only row derived from pinned Stim v1.16.0 C++ tests
pf4-dem-search-sat-repeat-resource-rust,PF4,src/stim/search/graphlike/algo.test.cc,structural,structural,cargo test stab-core DEM search and SAT repeat resource policy,cargo-test|-p|stab-core|--test|dem_search|pf4_dem_search_,,,0,any,implemented,Runs the RPF4 Rust DEM search and SAT repeat-resource subset proving shifted-repeat graphlike hypergraph and SAT behavior succeeds for bounded repeats graphlike and hypergraph skip excessive zero-probability repeat bodies selected flat detector-touching zero-shift graphlike and hypergraph search repeats selected detectorless logical-only zero-shift graphlike search repeats selected flat no-target zero-shift graphlike search repeats selected flat zero-detector-shift graphlike search repeats and selected flat annotation-bearing graphlike search repeats fold or skip to compact-model semantic parity weighted SAT omits zero-probability error variables skips excessive zero-probability repeat bodies and rejects shifted skipped-repeat dense-target explosion selected SAT flat-repeat folding integration is present but SAT-sourced unit evidence is owned by pf4-dem-sat-flat-repeat-fold-rust unweighted SAT keeps high-index dense-target structural caps and graphlike hypergraph and SAT reject unselected excessive active repeat expansion before materialization,Ported Rust tests derived from pinned Stim v1.16.0 graphlike hypergraph and SAT repeat semantics with Stab-specific resource hardening
pf4-dem-hypergraph-logical-repeat-rust,PF4,src/stim/search/hyper/algo.test.cc,structural,structural,cargo test stab-core hypergraph detectorless logical repeat search,cargo-test|-p|stab-core|--test|dem_search|pf4_hypergraph_logical_only_repeat,,,0,any,implemented,Runs the PFM4 Rust hypergraph detectorless logical-only search subset proving selected flat zero-shift detectorless logical-only hypergraph repeats fold to compact-model semantic parity and pinned Stim hypergraph detectorless distance-1 overwrite behavior,Ported Rust test derived from pinned Stim v1.16.0 hypergraph search behavior with Stab-specific repeat resource hardening
pf4-dem-hypergraph-no-target-repeat-rust,PF4,src/stim/search/hyper/algo.test.cc,structural,structural,cargo test stab-core hypergraph no-target repeat search,cargo-test|-p|stab-core|--test|dem_search|pf4_hypergraph_no_target_repeat,,,0,any,implemented,Runs the PFM4 Rust hypergraph no-target search subset proving selected flat zero-shift no-target hypergraph repeats skip to compact-model semantic parity while numeric raw error targets remain rejected at the typed boundary,Semantic-mining row derived from pinned Stim v1.16.0 hypergraph search semantics with Stab-specific repeat resource hardening
pf4-dem-hypergraph-zero-shift-repeat-rust,PF4,src/stim/search/hyper/algo.test.cc,structural,structural,cargo test stab-core hypergraph zero-detector-shift repeat search,cargo-test|-p|stab-core|--test|dem_search|pf4_hypergraph_zero_detector_shift,,,0,any,implemented,Runs the PFM4 Rust hypergraph zero-detector-shift search subset proving selected flat zero-shift `shift_detectors 0` hypergraph repeats fold to compact-model semantic parity while nonzero detector shifts remain capped,Semantic-mining row derived from pinned Stim v1.16.0 hypergraph search semantics with Stab-specific repeat resource hardening
pf4-dem-hypergraph-annotation-repeat-rust,PF4,src/stim/search/hyper/algo.test.cc,structural,structural,cargo test stab-core hypergraph annotation repeat search,cargo-test|-p|stab-core|--test|dem_search|pf4_hypergraph_annotation_repeat,,,0,any,implemented,Runs the PFM4 Rust hypergraph annotation-bearing search subset proving selected flat detector and logical_observable annotation-bearing hypergraph repeats fold to compact-model semantic parity while nonzero detector shifts remain capped,Semantic-mining row derived from pinned Stim v1.16.0 hypergraph search semantics with Stab-specific repeat resource hardening
pf4-dem-search-mixed-zero-probability-repeat-rust,PF4,src/stim/search/graphlike/algo.test.cc,structural,structural,cargo test stab-core graphlike mixed zero-probability repeat search,cargo-test|-p|stab-core|--test|dem_search_mixed_zero_probability_repeat|pf4_dem_search_mixed_zero_probability,,,0,any,implemented,Runs the PFM4 Rust graphlike mixed zero-probability search subset proving selected flat and nested zero-shift repeats with ignored zero-probability targets and active graphlike targets fold to compact-model semantic parity while nonzero detector shifts remain capped,Semantic-mining row derived from pinned Stim v1.16.0 graphlike search semantics with Stab-specific repeat resource hardening
pf4-dem-hypergraph-mixed-zero-probability-repeat-rust,PF4,src/stim/search/hyper/algo.test.cc,structural,structural,cargo test stab-core hypergraph mixed zero-probability repeat search,cargo-test|-p|stab-core|--test|dem_search_mixed_zero_probability_repeat|pf4_hypergraph_mixed_zero_probability_repeat,,,0,any,implemented,Runs the PFM4 Rust hypergraph mixed zero-probability search subset proving selected flat and nested zero-shift repeats with ignored zero-probability targets and active hypergraph targets fold to compact-model semantic parity while nonzero detector shifts remain capped,Semantic-mining row derived from pinned Stim v1.16.0 hypergraph search semantics with Stab-specific repeat resource hardening
pf4-dem-search-nested-repeat-rust,PF4,src/stim/search/graphlike/algo.test.cc,structural,structural,cargo test stab-core graphlike nested zero-shift repeat search,cargo-test|-p|stab-core|--test|dem_search_nested_repeat|pf4_dem_search_folds_nested_zero_shift,,,0,any,implemented,Runs the PFM4 Rust graphlike nested zero-shift search subset proving selected nested zero-detector-shift graphlike repeats fold to compact-model semantic parity while nonzero detector shifts remain capped,Semantic-mining row derived from pinned Stim v1.16.0 graphlike search semantics with Stab-specific nested-repeat resource hardening
pf4-dem-hypergraph-nested-repeat-rust,PF4,src/stim/search/hyper/algo.test.cc,structural,structural,cargo test stab-core hypergraph nested zero-shift repeat search,cargo-test|-p|stab-core|--test|dem_search_nested_repeat|pf4_hypergraph_nested_zero_shift,,,0,any,implemented,Runs the PFM4 Rust hypergraph nested zero-shift search subset proving selected nested zero-detector-shift hypergraph repeats fold to compact-model semantic parity while nonzero detector shifts remain capped,Semantic-mining row derived from pinned Stim v1.16.0 hypergraph search semantics with Stab-specific nested-repeat resource hardening
pf4-dem-sat-flat-repeat-fold-rust,PF4,src/stim/search/sat/wcnf.test.cc,structural,structural,cargo test stab-core selected SAT flat repeat folding,cargo-test|-p|stab-core|flat_zero_shift,,,0,any,implemented,Runs the RPF4 Rust SAT flat-repeat folding subset proving unweighted shortest-error SAT folds selected flat zero-shift repeats structurally including zero-probability mechanisms preserves dense observable caps for high-observable zero-probability repeats weighted SAT folds selected flat nonzero zero-shift repeats by concrete MAP parity cost deterministic weighted errors become hard clauses and unselected shifted repeats remain capped,Ported Rust tests derived from pinned Stim v1.16.0 SAT/WCNF semantics with Stab-specific repeat resource hardening
pf4-dem-sat-nested-repeat-fold-rust,PF4,src/stim/search/sat/wcnf.test.cc,structural,structural,cargo test stab-core selected SAT nested repeat folding,cargo-test|-p|stab-core|nested_zero_shift_repeats,,,0,any,implemented,Runs the PFM4 Rust SAT nested-repeat folding subset proving unweighted shortest-error SAT folds selected nested zero-shift repeats structurally including zero-probability and no-target mechanisms weighted SAT folds selected nested nonzero zero-shift repeats by concrete MAP parity cost weighted zero-probability nested repeats are omitted and shifted nested repeats remain capped,Ported Rust tests derived from pinned Stim v1.16.0 SAT/WCNF semantics with Stab-specific nested-repeat resource hardening
pf4-dem-analyzer-repeat-resource-rust,PF4,src/stim/simulators/error_analyzer.test.cc,structural,structural,cargo test stab-core DEM analyzer repeat resource policy,cargo-test|-p|stab-core|--test|dem_traversal_resource|pf4_dem_analyzer_,,,0,any,implemented,Runs the RPF4 Rust analyzer repeat-resource subset proving bounded analyzer repeat traversal succeeds and excessive analyzer repeat expansion is rejected before materialization,Ported Rust tests derived from pinned Stim v1.16.0 analyzer repeat semantics with Stab-specific resource hardening
pf4-error-matcher-repeat-resource-rust,PF4,src/stim/simulators/error_matcher.test.cc,structural,structural,cargo test stab-core ErrorMatcher repeat resource policy,cargo-test|-p|stab-core|--test|dem_traversal_resource|pf4_error_matcher_repeat_,,,0,any,implemented,Runs the RPF4 Rust ErrorMatcher circuit repeat-resource subset proving bounded repeat traversal succeeds repeat-contained circuit noise is rejected and excessive nested repeat traversal is rejected before materialization,Ported Rust tests derived from pinned Stim v1.16.0 ErrorMatcher repeat semantics with Stab-specific resource hardening
pf4-error-matcher-filter-repeat-rust,PF4,src/stim/simulators/error_matcher.test.cc,structural,structural,cargo test stab-core ErrorMatcher filter repeat resource policy,cargo-test|-p|stab-core|--test|dem_traversal_resource|pf4_error_matcher_filter_,,,0,any,implemented,Runs the RPF4 Rust ErrorMatcher filter DEM repeat subset proving shifted filter DEM repeats stay capped and selected flat detector-touching zero-shift filter DEM repeats fold to compact-filter semantic parity including multiple body errors logical terms duplicate detector cancellation separators and nonzero outer detector offsets,Semantic-mining row derived from pinned Stim v1.16.0 ErrorMatcher filter semantics with Stab-specific resource hardening
pf4-dem-sampler-repeat-resource-rust,PF4,src/stim/simulators/dem_sampler.test.cc,structural,structural,cargo test stab-core DEM sampler repeat resource policy,cargo-test|-p|stab-core|--test|dem_sampler|pf4_dem_sampler_,,,0,any,implemented,Runs the RPF4 Rust DEM sampler repeat-resource subset proving folded compilation past the previous repeat-count cap shifted-repeat detector sampling observable parity flat repeated error-bit replay direct detection-event zero-probability repeat skipping deterministic zero-shift repeat parity folding selected single-stochastic zero-shift repeat parity folding selected flat stochastic zero-shift repeat parity folding selected nested zero-shift stochastic repeat parity folding sampled-error materialization and replay caps and non-selected shifted stochastic sampled-error application work caps,Ported Rust tests derived from pinned Stim v1.16.0 DEM sampler repeat semantics with Stab-specific resource hardening
pf5-detecting-regions-extended,PF5,src/stim/util_top/circuit_to_detecting_regions.test.cc,structural,structural,manifest-only PF5 detecting regions split,manifest-only|pf5-detecting-regions-extended,,,0,any,manifest-only,RPF5 remaining subcases are target shapes outside the promoted positive set and source-owned fail-closed set plus broader generated-code regions beyond the promoted repetition-code and selected rotated and unrotated surface-code cases and broader gauge behavior; repeat traversal target filters selected target-shape support including selected CZ classical-only bit-bit no-op groups and source-owned non-CZ classical-bit rejection ordinary-noise tag traversal promoted Clifford propagation ignored anticommutation mode selected gauge behavior and selected generated-code regions have executable PF5 rows,Manifest-only row derived from pinned Stim v1.16.0 C++ tests
pf5-detecting-regions-repeat-rust,PF5,src/stim/util_top/circuit_to_detecting_regions.test.cc,structural,structural,cargo test stab-core detecting regions repeat traversal,cargo-test|-p|stab-core|detecting_regions_repeat_,,,0,any,implemented,Runs the PF5 Rust detecting-regions repeat traversal subset proving bounded repeat tick traversal and excessive repeat expansion rejection,Ported Rust tests derived from pinned Stim v1.16.0 circuit_to_detecting_regions repeat semantics with Stab-specific resource hardening
pf5-detecting-regions-targets-rust,PF5,src/stim/circuit/circuit_pybind_test.py,structural,structural,cargo test stab-core detecting regions target filters,cargo-test|-p|stab-core|detecting_regions_target_api,,,0,any,implemented,Runs the PF5 Rust detecting-regions target-filter subset proving detector and logical-observable DemTarget filters dense-capped default-like all-target and all-tick helpers MX and MZZ pinned examples duplicate target deduplication invalid target rejection and dense helper resource rejection,Ported Rust tests derived from pinned Stim v1.16.0 Circuit.detecting_regions Python examples
pf5-detecting-regions-target-shapes-rust,PF5,src/stim/simulators/sparse_rev_frame_tracker.test.cc,structural,structural,cargo test stab-core detecting regions selected target shapes,cargo-test|-p|stab-core|detecting_regions_target_shape,,,0,any,implemented,Runs the PF5 Rust detecting-regions target-shape subset proving inverted targets for promoted measurement and reset-measurement families preserve tick-indexed unsigned regions selected measurement-record feedback placements for CX CY CZ XCZ and YCZ propagate through detector regions selected gate-order-valid sweep-controlled Pauli groups for CX CY CZ XCZ and YCZ plus selected CZ classical-only bit-bit groups act as unsigned sign-only no-ops source-owned fail-closed validation covers non-CZ sweep-sweep record-sweep and record-record groups MPAD measurement pads and heralded record-producing noise drop record sensitivity while preserving measurement-record indexing MPP Pauli-product measurement targets feed detector and observable regions SPP and SPP_DAG unitary Pauli-product target shapes match decomposed propagation anti-Hermitian Pauli products reject and reset Clifford heralded-noise unsupported feedback validation remains scoped,Semantic-mining row derived from pinned Stim v1.16.0 inverted measurement target semantics detslice-text feedback semantics sweep-controlled Pauli selected CZ classical-only detecting-region no-op semantics and non-CZ classical-bit rejection semantics plus MPAD and heralded record-drop semantics MPP Pauli-product measurement semantics and SparseUnsignedRevFrameTracker product-measurement plus feedback plus SPP propagation coverage
pf5-detecting-regions-noise-tags-rust,PF5,src/stim/circuit/circuit_pybind_test.py,structural,structural,cargo test stab-core detecting regions ordinary noise and tags,cargo-test|-p|stab-core|detecting_regions_target,,,0,any,implemented,Runs the PF5 Rust detecting-regions ordinary-noise and tag subset proving tagged reset noise measurement and detector instructions match the pinned Stim tag example plus non-record-producing noise instructions are no-op while heralded record-producing noise is covered by the target-shape row,Ported from pinned Stim v1.16.0 Circuit.detecting_regions tagged-noise example with source-owned ordinary-noise category coverage
pf5-detecting-regions-clifford-rust,PF5,doc/python_api_reference_vDev.md,structural,structural,cargo test stab-core detecting regions Clifford gates,cargo-test|-p|stab-core|detecting_regions_clifford,,,0,any,implemented,Runs the PF5 Rust detecting-regions unsigned Clifford subset proving the full single-qubit Clifford gate set with plain qubit targets and fixed two-qubit tableau-backed Clifford gates with plain qubit-pair targets,Semantic-mining row derived from pinned Stim v1.16.0 detecting_regions and detslice-text documentation with source-owned expected regions recorded in docs/plans/rpf5-detecting-regions-progress-report.md
pf5-detecting-regions-anticommutation-rust,PF5,src/stim/util_top/circuit_to_detecting_regions_test.py,structural,structural,cargo test stab-core detecting regions anticommutation policy,cargo-test|-p|stab-core|detecting_regions_anticommutation,,,0,any,implemented,Runs the PF5 Rust detecting-regions anticommutation subset proving ignored anticommutation mode returns regions for in-circuit and implicit-start conflicts including empty output filters while default false mode still rejects those conflicts even when target or tick filters are empty,Ported Rust tests derived from pinned Stim v1.16.0 Circuit.detecting_regions anticommutation failures and C++ detecting-region ignore switch semantics
