id,milestone,threshold_class,runner,upstream_source,stim_perf_filter,argv,stdin_path,phase,measurement,description
pf4-dem-folded-traversal,PF4,non-primary-report-only,contract-only,src/stim/search/graphlike/algo.perf.cc,,,,analysis,dem-folded-traversal,PF4 planned folded DEM traversal workload pending runner extraction
pf4-dem-folded-graphlike-traversal,PF4,non-primary-report-only,contract-only,src/stim/search/graphlike/algo.perf.cc,,,,analysis,dem-folded-graphlike,PF4 planned folded DEM graphlike traversal workload pending runner extraction
pf4-dem-sampler-folded-repeat,PF4,non-primary-report-only,contract-only,src/stim/simulators/dem_sampler.test.cc,,,,throughput,dem-sampler-folded-repeat,PF4 planned DEM sampler folded-repeat workload pending runner extraction
pf5-detecting-regions-repeat,PF5,non-primary-report-only,contract-only,src/stim/util_top/circuit_to_detecting_regions.test.cc,,,,analysis,detecting-regions-repeat,PF5 planned detecting regions repeat traversal workload pending runner extraction
pf5-missing-detectors-mpp,PF5,non-primary-report-only,contract-only,src/stim/util_top/missing_detectors.test.cc,,,,analysis,missing-detectors-mpp,PF5 planned MPP missing-detectors workload pending runner extraction
pf5-missing-detectors-generated-code,PF5,non-primary-report-only,contract-only,src/stim/util_top/missing_detectors.test.cc,,,,analysis,missing-detectors-generated,PF5 planned generated-code missing-detectors workload pending runner extraction
pf5-flow-solve-measurement-rich,PF5,non-primary-report-only,contract-only,src/stim/stabilizers/flow.test.cc,,,,analysis,flow-solve,PF5 planned measurement-rich flow solving workload pending runner extraction
pf5-has-all-flows-batch,PF5,non-primary-report-only,contract-only,src/stim/util_top/has_flow.test.cc,,,,analysis,has-all-flows,PF5 planned has_all_flows batch workload pending runner extraction
pf6-analyze-errors-generated-surface,PF6,non-primary-report-only,contract-only,src/stim/simulators/error_analyzer.perf.cc,,,,analysis,analyze-errors-generated,PF6 planned generated-circuit analyzer workload pending runner extraction
pf6-error-decomp-loop-folded,PF6,non-primary-report-only,contract-only,src/stim/simulators/error_analyzer.test.cc,,,,analysis,error-decomp-loop-folded,PF6 planned loop-folded error decomposition workload pending runner extraction
pf6-graphlike-search-generated,PF6,non-primary-report-only,contract-only,src/stim/search/graphlike/algo.perf.cc,,,,analysis,graphlike-search-generated,PF6 planned generated graphlike search workload pending runner extraction
pf6-hypergraph-search-generated,PF6,non-primary-report-only,contract-only,src/stim/search/hyper/algo.test.cc,,,,analysis,hypergraph-search-generated,PF6 planned generated hypergraph search workload pending runner extraction
pf6-sparse-rev-frame-loop,PF6,non-primary-report-only,contract-only,src/stim/simulators/sparse_rev_frame_tracker.test.cc,,,,analysis,sparse-rev-frame,PF6 planned sparse reverse frame loop-folding workload pending runner extraction
pf7-cli-m2d-sweep-b8,PF7,non-primary-report-only,contract-only,src/stim/cmd/command_m2d.test.cc,,,,throughput,cli-m2d-sweep,PF7 planned public CLI m2d sweep workload pending runner extraction
pf7-cli-m2d-feedback-inline,PF7,non-primary-report-only,contract-only,src/stim/cmd/command_m2d.test.cc,,,,throughput,cli-m2d-feedback-inline,PF7 planned public CLI m2d feedback-inlining workload pending runner extraction
pf7-cli-analyze-errors-generated,PF7,non-primary-report-only,contract-only,src/stim/cmd/command_analyze_errors.test.cc,,,,analysis,cli-analyze-errors-generated,PF7 planned public CLI generated-circuit analyze_errors workload pending runner extraction
pf7-cli-analyze-errors-decompose,PF7,non-primary-report-only,contract-only,src/stim/cmd/command_analyze_errors.test.cc,,,,analysis,cli-analyze-errors,PF7 planned public CLI analyze_errors decomposition workload pending runner extraction
pf7-cli-legacy-dispatch-startup,PF7,non-primary-report-only,contract-only,src/stim/main_namespaced.perf.cc,,,,startup,cli-legacy-dispatch,PF7 planned accepted legacy dispatch startup workload pending runner extraction
